{"$id":"https://capht.tech/schemas/reviewgraphen/benchmark/score.v1","$schema":"https://json-schema.org/draft/2020-12/schema","additionalProperties":false,"allOf":[{"if":{"properties":{"outcome":{"enum":["abstained","parse_failure"]}},"required":["outcome"]},"then":{"properties":{"candidate_count":{"const":0},"matched_candidate_count":{"const":0},"unmatched_candidate_count":{"const":0}}}}],"properties":{"arm":{"enum":["b1_free_form","g3_proxy","full_review_graphen"]},"candidate_count":{"minimum":0,"type":"integer"},"candidate_hash":{"pattern":"^sha256:[0-9a-f]{64}$","type":"string"},"detected_root_count":{"minimum":0,"type":"integer"},"input_tree_hash":{"pattern":"^git:[0-9a-f]{40}$","type":"string"},"manifest_hash":{"pattern":"^sha256:[0-9a-f]{64}$","type":"string"},"matched_candidate_count":{"minimum":0,"type":"integer"},"mechanism_ontology_version":{"const":"reviewgraphen.benchmark.mechanism_ontology.v1"},"oracle_hash":{"pattern":"^sha256:[0-9a-f]{64}$","type":"string"},"outcome":{"enum":["structured","abstained","parse_failure"]},"paired_configuration_hash":{"pattern":"^sha256:[0-9a-f]{64}$","type":"string"},"protocol_version":{"const":"reviewgraphen.benchmark.protocol.v2"},"replicate":{"minimum":1,"type":"integer"},"root_count":{"minimum":0,"type":"integer"},"schema":{"const":"reviewgraphen.benchmark.score.v1"},"trial_id":{"maxLength":4096,"minLength":1,"type":"string"},"unit_id":{"maxLength":4096,"minLength":1,"type":"string"},"unmatched_candidate_count":{"minimum":0,"type":"integer"}},"required":["schema","trial_id","unit_id","arm","replicate","manifest_hash","candidate_hash","oracle_hash","input_tree_hash","protocol_version","mechanism_ontology_version","paired_configuration_hash","root_count","detected_root_count","candidate_count","matched_candidate_count","unmatched_candidate_count","outcome"],"type":"object"}
