{"arm":"g3_proxy","candidate_count":1,"candidate_hash":"sha256:902718f85243c1815c5339280dfa31179c2731e6c3aa80c2786ca95986009ed0","detected_root_count":0,"input_tree_hash":"git:aea75a6b4a8fa0bd6fb89c30e6e4d3c33b597b19","manifest_hash":"sha256:4bbb8f64340a4059c9ee181f7bc8b0d33f2a8cb92415bd46560202f3459f891f","matched_candidate_count":0,"mechanism_ontology_version":"reviewgraphen.benchmark.mechanism_ontology.v1","oracle_hash":"sha256:58d3a7d8d48fec0dcf86ffb1ffaa191c9ea1b59b6fa52e603fca12df844b3e93","outcome":"structured","paired_configuration_hash":"sha256:ae6fcbd19aeac437d4c5a4328169c6b92c1289006580541ee8af5bbd3d52ac88","protocol_version":"reviewgraphen.benchmark.protocol.v2","replicate":1,"root_count":0,"schema":"reviewgraphen.benchmark.score.v1","trial_id":"m7:unit:c4z9:g3_proxy:1","unit_id":"unit:c4z9","unmatched_candidate_count":1}
